{
  "schemaVersion": 2,
  "catalogVersion": "1.0.0-prototype.3",
  "preparedOn": "2026-10-09",
  "updatedOn": "2026-10-09",
  "title": "HeritageXR — Égypte antique",
  "collectionId": "ancient_egypt",
  "defaultLanguage": "fr",
  "supportedLanguages": [
    "fr",
    "ar",
    "en"
  ],
  "status": "integrated_prototype_pending_device_validation",
  "sourceInventory": "AssetSources/inventory.json",
  "unityCollectionAsset": "Assets/HeritageXR/Content/Collection.asset",
  "artworks": [
    {
      "id": "bm_ea24",
      "museumObjectId": "EA24",
      "publicationStatus": "draft",
      "texts": [
        {
          "language": "fr",
          "title": "Pierre de Rosette",
          "summary": "Une stèle portant un décret en trois écritures, essentielle au déchiffrement des hiéroglyphes.",
          "description": "La pierre de Rosette est un fragment de stèle en granodiorite portant un décret en l’honneur de Ptolémée V. Le texte est inscrit en hiéroglyphes, en démotique et en grec. La comparaison de ces écritures a fourni une clé majeure au déchiffrement des hiéroglyphes égyptiens.",
          "descriptionStatus": "source_grounded_draft_not_curator_reviewed",
          "sources": [
            "https://github.com/BritishMuseumDH/rosettaStone",
            "https://sketchfab.com/3d-models/the-rosetta-stone-1e03509704a3490e99a173e53b93e282"
          ]
        },
        {
          "language": "ar",
          "title": "حجر رشيد",
          "summary": "جزء من لوحة تحمل مرسومًا بثلاثة أنظمة كتابة، وكان أساسيًا في فك رموز الهيروغليفية.",
          "description": "حجر رشيد جزء من لوحة من الجرانوديوريت تحمل مرسومًا تكريمًا لبطليموس الخامس. كُتب النص بالهيروغليفية والديموطيقية واليونانية. وقد وفرت مقارنة هذه الكتابات مفتاحًا مهمًا لفك رموز الهيروغليفية المصرية.",
          "descriptionStatus": "translation_of_french_source_grounded_draft_not_curator_reviewed",
          "sources": [
            "https://github.com/BritishMuseumDH/rosettaStone",
            "https://sketchfab.com/3d-models/the-rosetta-stone-1e03509704a3490e99a173e53b93e282"
          ]
        },
        {
          "language": "en",
          "title": "Rosetta Stone",
          "summary": "A stele bearing a decree in three scripts, central to deciphering hieroglyphs.",
          "description": "The Rosetta Stone is a fragment of a granodiorite stele bearing a decree in honour of Ptolemy V. The text is written in hieroglyphs, Demotic and Greek. Comparing these scripts provided a major key to deciphering Egyptian hieroglyphs.",
          "descriptionStatus": "translation_of_french_source_grounded_draft_not_curator_reviewed",
          "sources": [
            "https://github.com/BritishMuseumDH/rosettaStone",
            "https://sketchfab.com/3d-models/the-rosetta-stone-1e03509704a3490e99a173e53b93e282"
          ]
        }
      ],
      "model": {
        "sourcePath": "AssetSources/BritishMuseum/DH-OculusVR-models-master/models/Gallery4-rendered10K/rosetta-stone-EA24/fiveHundred.obj",
        "materialPaths": [
          "AssetSources/BritishMuseum/DH-OculusVR-models-master/models/Gallery4-rendered10K/rosetta-stone-EA24/fiveHundred.obj.mtl"
        ],
        "texturePaths": [
          "AssetSources/BritishMuseum/DH-OculusVR-models-master/models/Gallery4-rendered10K/rosetta-stone-EA24/fiveHundred.jpg"
        ],
        "triangleCount": 10000,
        "addressableKey": null,
        "licence": "CC-BY-NC-SA-4.0",
        "sourceRepository": "https://github.com/BritishMuseumDH/DH-OculusVR-models",
        "credits": [
          "Daniel Pett",
          "Jennifer Wexler",
          "Thomas Flynn",
          "Copyright Trustees of the British Museum"
        ],
        "importStatus": "imported_in_unity_prototype",
        "unityPrefabPath": "Assets/HeritageXR/Models/bm_ea24/Artwork.prefab",
        "displayLongestAxisMeters": 0.2
      },
      "targets": [
        {
          "id": "target_bm_ea24",
          "path": "AssetSources/Images/Source/rosetta_stone.jpg",
          "bytes": 1048282,
          "sha256": "3ec757ef8d870f64b23addc6b756f1cb5d9fbc8b732f17514f82a12d155ebd1b",
          "sha1": "8a9493c12ac8e06e2696e9950798383422ee9215",
          "pixelWidth": 1846,
          "pixelHeight": 3091,
          "sourcePage": "https://commons.wikimedia.org/wiki/File:Rosetta_Stone_at_the_British_Museum.jpg",
          "author": "BabelStone",
          "licence": "CC-BY-SA-3.0",
          "licenceUrl": "https://creativecommons.org/licenses/by-sa/3.0/",
          "modified": false,
          "imageRole": "candidate_reference_image",
          "physicalWidthMeters": 0.12,
          "printed": false,
          "arTrackingValidated": false,
          "identityVerification": null,
          "authorNote": null,
          "dimensionStatus": "prototype_print_specification_not_measured",
          "unityTexturePath": "Assets/HeritageXR/Photos/bm_ea24.jpg",
          "referenceLibraryPath": "Assets/HeritageXR/Settings/ArtworkImages.asset",
          "addressableKey": null,
          "preparationStatus": "image_imported_existing_prototype"
        }
      ],
      "audio": [
        {
          "id": "bm_ea24.narration.fr",
          "language": "fr",
          "kind": "narration",
          "scriptVersion": 1,
          "scriptPath": "Content/NarrationScripts/bm_ea24/narration.fr.txt",
          "scriptSha256": "3b40f0717b84e929e7f87d252ab9813b1942a6b968ac1e714e6e84e36b7ef940",
          "scriptStatus": "draft",
          "audioStatus": "received",
          "sourceAudioPath": "AssetSources/Audio/bm_ea24/narration.fr.mp3",
          "unityAudioPath": "Assets/HeritageXR/Audio/bm_ea24/narration.fr.mp3",
          "addressableKey": null,
          "durationSeconds": 28.551837,
          "channels": 1,
          "sampleRateHz": 44100,
          "voiceId": "6DEjyaHWnTHsvXM5Byys",
          "generationModelId": "eleven_multilingual_v2",
          "generationSettings": {
            "generationsCount": 1
          },
          "subtitlesPath": "Content/Subtitles/bm_ea24/narration.fr.json",
          "subtitlesStatus": "draft",
          "subtitleSegments": [
            {
              "startSeconds": 0.08,
              "endSeconds": 2.921,
              "text": "Voici la pierre de Rosette,\nun fragment de stèle en"
            },
            {
              "startSeconds": 2.921,
              "endSeconds": 5.883,
              "text": "granodiorite. Elle porte un\ndécret de l’année cent"
            },
            {
              "startSeconds": 5.883,
              "endSeconds": 8.824,
              "text": "quatre-vingt-seize avant\nnotre ère, en l’honneur de"
            },
            {
              "startSeconds": 8.824,
              "endSeconds": 12.126,
              "text": "Ptolémée le cinquième. Le\nmême décret apparaît en trois"
            },
            {
              "startSeconds": 12.126,
              "endSeconds": 15.928,
              "text": "écritures : les hiéroglyphes,\nle démotique et le grec."
            },
            {
              "startSeconds": 16.408,
              "endSeconds": 19.029,
              "text": "Leur comparaison a aidé à\ndéchiffrer les hiéroglyphes"
            },
            {
              "startSeconds": 19.029,
              "endSeconds": 22.491,
              "text": "égyptiens. Observez les\ndifférents groupes de signes sur"
            },
            {
              "startSeconds": 22.491,
              "endSeconds": 23.291,
              "text": "sa surface."
            },
            {
              "startSeconds": 23.852,
              "endSeconds": 26.653,
              "text": "Ce fragment rappelle comment\nun texte peut ouvrir une"
            },
            {
              "startSeconds": 26.653,
              "endSeconds": 28.234,
              "text": "fenêtre sur une\ncivilisation."
            }
          ],
          "credits": [
            "Synthetic speech generated with ElevenLabs; voice: Hugo — Deep French Storyteller"
          ],
          "licence": null
        },
        {
          "id": "bm_ea24.audio_description.fr",
          "language": "fr",
          "kind": "audio_description",
          "scriptVersion": 1,
          "scriptPath": "Content/NarrationScripts/bm_ea24/audio_description.fr.txt",
          "scriptSha256": "31b46eccf2a902f9fce339b8688be636dfa40ed18496f2dd7325fe3b855aa2bc",
          "scriptStatus": "draft",
          "audioStatus": "received",
          "sourceAudioPath": "AssetSources/Audio/bm_ea24/audio_description.fr.mp3",
          "unityAudioPath": "Assets/HeritageXR/Audio/bm_ea24/audio_description.fr.mp3",
          "addressableKey": null,
          "durationSeconds": 21.394286,
          "channels": 1,
          "sampleRateHz": 44100,
          "voiceId": "6DEjyaHWnTHsvXM5Byys",
          "generationModelId": "eleven_multilingual_v2",
          "generationSettings": {
            "generationsCount": 1
          },
          "subtitlesPath": "Content/Subtitles/bm_ea24/audio_description.fr.json",
          "subtitlesStatus": "draft",
          "subtitleSegments": [
            {
              "startSeconds": 0.08,
              "endSeconds": 3.263,
              "text": "La pierre se présente comme\nune plaque épaisse dressée"
            },
            {
              "startSeconds": 3.404,
              "endSeconds": 7.988,
              "text": "verticalement. Sa face\nprincipale porte des rangées"
            },
            {
              "startSeconds": 7.988,
              "endSeconds": 10.751,
              "text": "serrées de signes gravés. La\npartie supérieure est"
            },
            {
              "startSeconds": 10.751,
              "endSeconds": 13.214,
              "text": "brisée et son contour est\nirrégulier."
            },
            {
              "startSeconds": 13.514,
              "endSeconds": 16.077,
              "text": "Les inscriptions forment\nplusieurs ensembles superposés."
            },
            {